{
  "schema_version": 1,
  "last_updated": "2026-05-10",
  "outcome_categories": {
    "OPERATING": "Company still actively running",
    "ACQUIRED": "Acquired by another company",
    "EXITED_OTHER": "IPO, merger, or other formal exit",
    "PIVOTED": "Same legal entity (or rebranded entity) now doing something different",
    "DORMANT": "Website still up but no apparent activity for 12+ months",
    "SHUT_DOWN": "Confirmed closed",
    "NO_PUBLIC_OUTCOME_FOUND": "Research came up empty"
  },
  "outcomes": [
    {
      "team": "ZeroWatt Technologies",
      "year": 2009,
      "award": "Grand Prize",
      "category": "NO_PUBLIC_OUTCOME_FOUND",
      "confidence": "likely defunct",
      "summary": "Co-founder Fred Tzeng has moved on to other companies. The SBIR-stage company has no active web presence as a chip-design startup. A separate 'Zerowatt Energy' (India-based industrial-energy AI) is unrelated.",
      "sources": [
        "https://legacy.www.sbir.gov/sbc/zerowatt-technologies-inc",
        "https://www.zoominfo.com/p/Fred-Tzeng/1406921498"
      ]
    },
    {
      "team": "Prescient Imaging",
      "year": 2012,
      "award": "Grand Prize",
      "category": "OPERATING",
      "confidence": "confirmed",
      "summary": "Received 510(k) FDA clearance in March 2021 for the BBX-PET portable PET scanner. Founders and private investors have put in over $8M total; focused on Alzheimer's neurology applications.",
      "sources": [
        "https://www.accessdata.fda.gov/cdrh_docs/pdf21/K210450.pdf",
        "https://merage.uci.edu/news/2022/05/Merage-Competition-Winner-Is-Poised-to-Disrupt-Medical-Imaging-Industry.html"
      ]
    },
    {
      "team": "Laser Associated Sciences",
      "team_aliases": ["LAS"],
      "year": 2013,
      "award": "Grand Prize",
      "category": "ACQUIRED",
      "confidence": "confirmed",
      "summary": "Acquired by Medtronic on April 14, 2020 for undisclosed terms. Received FlowMet-R 510(k) FDA clearance in 2019. Founder/CEO Sean White now leads Medtronic's diagnostics & monitoring group.",
      "acquirer": "Medtronic",
      "acquisition_date": "2020-04",
      "acquisition_date_note": "OC Business Journal reported the news on 2020-04-14; UCI Innovation announcement dated 2020-04-29. Exact deal-close date not pinned to a single day across sources.",
      "acquisition_terms": "undisclosed",
      "sources": [
        "https://innovation.uci.edu/2020/04/medtronic-acquires-cove-tenant-laser-associated-sciences/",
        "https://www.ocbj.com/news/2020/apr/14/medtronic-buys-device-maker/"
      ]
    },
    {
      "team": "iBesties",
      "year": 2014,
      "award": "Grand Prize",
      "category": "PIVOTED",
      "confidence": "confirmed pivot, likely dormant",
      "summary": "Rebranded as 'Middle School Moguls' in 2016, hit Target shelves fall 2016, adapted into a 4-episode CG miniseries with Nickelodeon in 2019. No evidence of activity past 2021.",
      "rebranded_to": "Middle School Moguls",
      "sources": [
        "https://dollect.net/database/middle-school-moguls/",
        "https://www.themarysue.com/ibesties/"
      ]
    },
    {
      "team": "EmbryLux",
      "year": 2016,
      "award": "Grand Prize",
      "category": "NO_PUBLIC_OUTCOME_FOUND",
      "confidence": "no findable commercial outcome",
      "summary": "The 2016 UCI design site exists, plus a 2019 Rice Business Plan Competition appearance under 'Embryologic'. No Crunchbase or current company site. Underlying FLIM-phasor IVF research published in Scientific Reports (2019).",
      "sources": [
        "https://www.nature.com/articles/s41598-019-48107-2"
      ]
    },
    {
      "team": "Purist",
      "year": 2017,
      "award": "Grand Prize (School of Medicine)",
      "category": "OPERATING",
      "confidence": "confirmed",
      "summary": "Founder Leila Safavi runs puristinc.com. Oak Ridge National Lab Innovation Crossroads Cohort 3 fellow; received $223K NIH SBIR in 2019. Still small/seed stage with no announced funding round beyond grants.",
      "sources": [
        "https://www.puristinc.com/about",
        "https://www.linkedin.com/in/leilasafavi/"
      ]
    },
    {
      "team": "APIC Diagnostics",
      "year": 2017,
      "award": "Tech Surge 2nd",
      "category": "NO_PUBLIC_OUTCOME_FOUND",
      "confidence": "no findable outcome",
      "summary": "Original UCI source describes APIC as a non-invasive point-of-care malaria test (the archive's 'saliva diagnostic' label may be inaccurate). No web presence post-2017.",
      "sources": [
        "https://innovation.uci.edu/2017/06/tech-surge-purist-takes-top-prize-in-2017-tech-surge-competition/"
      ]
    },
    {
      "team": "Esqalate",
      "year": 2017,
      "award": "Track Award (Poverty Alleviation) 1st",
      "category": "DORMANT",
      "confidence": "likely",
      "summary": "Crunchbase profile exists; the platforms proboknow.com and lowboknow.com show parking pages or expired domains. Founder Chad Trainer's nonprofit raised about $100K but no public activity post-2018.",
      "sources": [
        "https://www.crunchbase.com/organization/esqalate",
        "http://lowboknow.com/"
      ]
    },
    {
      "team": "BrainCheck",
      "year": 2017,
      "award": "Track Award (Consumer Products) 1st",
      "category": "NO_PUBLIC_OUTCOME_FOUND",
      "confidence": "likely never commercialized",
      "summary": "UCI senior design / research project rather than an incorporated startup. Open-source code on GitHub but no company entity traceable. A separate Houston-based 'BrainCheck Inc.' is unrelated.",
      "sources": [
        "https://faculty.sites.uci.edu/ucibci/2017/03/29/portable-low-cost-and-open-source-brain-computer-interface-bci-arduino-based-system/"
      ]
    },
    {
      "team": "Mechanodontics",
      "year": 2018,
      "award": "Track Award (Life Sciences) 1st",
      "category": "OPERATING",
      "confidence": "confirmed; well-funded",
      "summary": "Rebranded as BRIUS Technologies (Carrollton, TX). Launched the Brava hidden-braces system commercially in 2022. Total funding ~$46M per PitchBook, including a May 2025 round of ~$19.45M led by View Ventures.",
      "rebranded_to": "BRIUS Technologies",
      "total_funding_usd_approx": 46000000,
      "sources": [
        "https://pitchbook.com/profiles/company/227480-59",
        "https://orthodonticproductsonline.com/treatment-products/brackets-wires/wires/brius-technologies-releases-alternative-braces-aligners-brava/"
      ]
    },
    {
      "team": "Apeel Juice",
      "year": 2018,
      "award": "Track Award (Social Enterprise) 1st",
      "category": "NO_PUBLIC_OUTCOME_FOUND",
      "confidence": "no findable outcome",
      "summary": "Founder Keene Do's juice startup has no traceable commercial presence post-2018. Not to be confused with Apeel Sciences (Santa Barbara coatings company), which is unrelated.",
      "sources": [
        "https://uciblumcenter.medium.com/uci-new-venture-competition-social-enterprise-track-f595002d462e"
      ]
    },
    {
      "team": "Closed Loop Plastics",
      "year": 2018,
      "award": "Tech Surge 2nd",
      "category": "SHUT_DOWN",
      "confidence": "likely",
      "summary": "closedloopplastics.com now serves a Sedo parking page. LinkedIn page exists but most recent press coverage is from 2021. Moved from UCI to Long Beach for a brief expansion phase but appears wound down.",
      "sources": [
        "https://www.closedloopplastics.com/",
        "https://lbbusinessjournal.com/business/news/long-beach-startup-closed-loop-plastics-looks-to-expand/"
      ]
    },
    {
      "team": "ARTEM",
      "year": 2018,
      "award": "Track Award (Consumer Products) 1st",
      "category": "NO_PUBLIC_OUTCOME_FOUND",
      "confidence": "no findable outcome",
      "summary": "A UCI undergrad team's online marketplace for underground artists 18-24. No Crunchbase, no surviving site, no LinkedIn company page traceable.",
      "sources": [
        "http://antrepreneur.uci.edu/blog/startups/artem-nvc/"
      ]
    },
    {
      "team": "First Step Diagnostics",
      "year": 2018,
      "award": "Track Award (Life Sciences) 2nd + Tech Surge 1st",
      "category": "NO_PUBLIC_OUTCOME_FOUND",
      "confidence": "no findable outcome",
      "summary": "No traceable follow-on commercial activity for the 2018 First Step Diagnostics team (Max Lechner, Hannah Mylabathula, Dr. Elizabeth Chao, Dave Ferguson). An earlier draft of this archive incorrectly linked First Step Diagnostics to NeuroQure; verification on 2026-05-11 confirmed NeuroQure was independently founded by Dave Justus based on Prof. John Jay Gargus's CART research, with no documented connection to First Step Diagnostics.",
      "sources": []
    },
    {
      "team": "CarDana",
      "year": 2018,
      "award": "Track Award (Social Enterprise) 2nd",
      "category": "OPERATING",
      "confidence": "confirmed",
      "summary": "Transparent charitable vehicle-donation platform; site live at cardana.co with active KBB-based donation flow, partner/charity onboarding, and a 20% flat-fee model.",
      "sources": [
        "https://cardana.co/about/"
      ]
    },
    {
      "team": "Wing",
      "team_aliases": ["Wing Assistant"],
      "year": 2018,
      "award": "Track Award (Consumer Services) 1st",
      "category": "OPERATING",
      "confidence": "confirmed",
      "summary": "Rebranded as Wing Assistant. Raised a $2.1M seed in 2021. Continues as a subscription managed-virtual-assistant service in 2025-2026 with newer tooling (Pie by Wing).",
      "rebranded_to": "Wing Assistant",
      "total_funding_usd_approx": 2100000,
      "sources": [
        "https://merage.uci.edu/news/2021/12/A-Pandemic-Pivot-Results-in-2.1-Million-in-Seed-Funding-for-Wing-Assistant.html",
        "https://www.technology.org/2025/12/16/wing-assistant-review-2025-is-it-the-best-unlimited-va-service/"
      ]
    },
    {